{
  "$schema": "https://json-schema.org/draft/2020-12/schema",
  "$id": "https://40kdc.dev/schemas/enrichment/ability-dsl/ability.schema.json",
  "title": "Ability DSL Entry",
  "description": "Community-authored structured representation of what a game ability does. NOT GW text.",
  "type": "object",
  "properties": {
    "ability_id": { "$ref": "../../defs/common.schema.json#/$defs/entity-id" },
    "name": { "type": "string" },
    "authored_by": { "$ref": "../../defs/common.schema.json#/$defs/contributor-ref" },
    "game_version": { "$ref": "../../defs/game-version-ref.schema.json" },
    "version": { "$ref": "../../defs/common.schema.json#/$defs/dataslate-version" },
    "supersedes": {
      "oneOf": [
        { "$ref": "../../defs/common.schema.json#/$defs/dataslate-version" },
        { "type": "null" }
      ]
    },
    "unit_ids": { "type": "array", "items": { "$ref": "../../defs/common.schema.json#/$defs/entity-id" } },
    "faction_id": {
      "oneOf": [
        { "$ref": "../../defs/common.schema.json#/$defs/entity-id" },
        { "type": "null" }
      ],
      "description": "For faction-type abilities, the faction this rule belongs to"
    },
    "detachment_id": {
      "oneOf": [
        { "$ref": "../../defs/common.schema.json#/$defs/entity-id" },
        { "type": "null" }
      ],
      "description": "For detachment/enhancement/stratagem-type abilities, the associated detachment"
    },
    "ability_type": { "type": "string", "enum": ["core", "faction", "detachment", "unit", "enhancement", "stratagem"] },
    "behavior": {
      "type": "string",
      "enum": ["passive", "activated", "reactive", "aura"],
      "description": "How this ability interacts with the game flow — not a runtime predicate"
    },
    "effect": { "$ref": "effect.schema.json" },
    "trigger": {
      "description": "For reactive abilities: the game event(s) this ability fires on, plus structured guards. One trigger object, OR an array of trigger objects — the ability fires on ANY listed trigger (models multi-event reactions like 'set up OR ends a move'). See `$defs/trigger`.",
      "oneOf": [
        { "$ref": "#/$defs/trigger" },
        { "type": "array", "minItems": 1, "items": { "$ref": "#/$defs/trigger" } }
      ]
    },
    "scope": { "$ref": "scope.schema.json" },
    "usage": {
      "description": "How often the ability may be used, beyond what scope.duration captures. `scope.duration: one-use` already models 'once per battle'; this models finer limits (once per turn/phase, N per battle) and an optional per-army/unit/model granularity.",
      "type": "object",
      "properties": {
        "frequency": {
          "type": "string",
          "enum": ["once-per-turn", "once-per-phase", "once-per-command-phase", "once-per-opponent-turn", "n-per-battle", "first-this-battle", "first-time-this-phase"]
        },
        "count": { "type": "integer", "minimum": 1 },
        "per": { "type": "string", "enum": ["army", "unit", "model"] }
      },
      "required": ["frequency"],
      "additionalProperties": false
    },
    "applies_to": {
      "description": "Static, human-curated keyword filter naming which datasheet units this ability benefits, for roster-side highlighting. A unit matches when it carries every keyword in `required_keywords` (across its `keywords` + `faction_keywords`) and none in `excluded_keywords`. This is a denormalized projection distinct from the runtime `effect` condition tree (which mixes static class, runtime-granted markers, and timing gates and must not be scraped for scope). Absent/null means no resolvable unit scope — consumers render no highlight rather than guess.",
      "oneOf": [
        {
          "type": "object",
          "properties": {
            "required_keywords": { "$ref": "../../defs/common.schema.json#/$defs/keyword-list" },
            "excluded_keywords": { "$ref": "../../defs/common.schema.json#/$defs/keyword-list" }
          },
          "additionalProperties": false
        },
        { "type": "null" }
      ]
    },
    "interactions": {
      "type": "array",
      "items": {
        "type": "object",
        "properties": {
          "ability_ref": { "$ref": "../../defs/common.schema.json#/$defs/entity-id" },
          "type": { "type": "string", "enum": ["conflicts-with", "combos-with", "superseded-by", "requires", "replaces"] },
          "notes": { "type": "string" }
        },
        "required": ["ability_ref", "type"]
      }
    },
    "disputed": { "type": "boolean", "default": false },
    "dispute_notes": { "type": "string" },
    "community_notes": { "type": "string" }
  },
  "required": ["ability_id", "name", "authored_by", "game_version", "effect", "scope"],
  "additionalProperties": false,
  "$defs": {
    "trigger": {
      "description": "A single reactive trigger: the game `event` (closed dispatch key), `subject` (whose action triggered it), `proximity` (spatial gate in inches), optional `move_types` (restricts a move event to given move kinds), `condition` (extra gate reusing the condition tree), `optional` ('you can' reactions), `cost` (stratagem-style CP), and `window` (how long the granted reaction stays open).",
      "type": "object",
      "properties": {
        "event": { "$ref": "../../defs/common.schema.json#/$defs/game-event" },
        "subject": {
          "type": "string",
          "enum": ["self", "bearer", "friendly-unit", "enemy-unit", "any-unit", "model-in-bearer"]
        },
        "proximity": {
          "type": "object",
          "properties": {
            "of": { "type": "string", "enum": ["self", "bearer", "attached-unit"] },
            "range": { "type": "number", "exclusiveMinimum": 0 }
          },
          "required": ["range"],
          "additionalProperties": false
        },
        "move_types": {
          "type": "array",
          "minItems": 1,
          "items": { "type": "string", "enum": ["normal", "advance", "fall-back", "charge"] },
          "description": "Restricts a move-related event (e.g. enemy-unit-ended-move) to these move kinds — e.g. [normal, advance, fall-back] for 'a Normal, Advance or Fall Back move'."
        },
        "condition": { "$ref": "condition.schema.json" },
        "optional": { "type": "boolean", "default": false },
        "cost": {
          "type": "object",
          "properties": { "cp": { "type": "integer", "minimum": 0 } },
          "additionalProperties": false
        },
        "window": { "type": "string" }
      },
      "required": ["event"],
      "additionalProperties": false
    }
  }
}
