[
  {
    "ability_id": "deadly-demise-d3",
    "name": "Deadly Demise D3",
    "authored_by": "40kdc-community",
    "game_version": {
      "edition": "11th",
      "dataslate": "pre-launch-provisional"
    },
    "version": "2025-q3",
    "effect": {
      "type": "conditional",
      "condition": {
        "type": "timing-is",
        "parameters": {
          "timing": "before-bearer-removed"
        }
      },
      "effect": {
        "type": "dice-gated",
        "dice": "D6",
        "threshold": 6,
        "comparison": "gte",
        "on_success": {
          "type": "mortal-wounds",
          "target": "enemy-within-aura",
          "modifier": {
            "count": "D3",
            "range": 6
          }
        },
        "on_fail": null
      }
    },
    "scope": {
      "range": "aura-6",
      "duration": "permanent"
    },
    "unit_ids": [
      "ghost-ark"
    ],
    "ability_type": "core",
    "behavior": "reactive"
  },
  {
    "ability_id": "repair-barge",
    "name": "Repair Barge",
    "authored_by": "40kdc-community",
    "game_version": {
      "edition": "11th",
      "dataslate": "pre-launch-provisional"
    },
    "version": "2025-q3",
    "effect": {
      "type": "ability-grant",
      "target": "unit",
      "modifier": {
        "ability_id": "once-per-round-special"
      }
    },
    "scope": {
      "range": "aura-6",
      "duration": "permanent"
    },
    "unit_ids": [
      "ghost-ark"
    ],
    "ability_type": "unit",
    "behavior": "passive",
    "usage": {
      "frequency": "once-per-turn"
    }
  },
  {
    "ability_id": "deadly-demise-d6-2",
    "name": "Deadly Demise D6+2",
    "authored_by": "40kdc-community",
    "game_version": {
      "edition": "11th",
      "dataslate": "pre-launch-provisional"
    },
    "version": "2025-q3",
    "effect": {
      "type": "conditional",
      "condition": {
        "type": "timing-is",
        "parameters": {
          "timing": "before-bearer-removed"
        }
      },
      "effect": {
        "type": "dice-gated",
        "dice": "D6",
        "threshold": 6,
        "comparison": "gte",
        "on_success": {
          "type": "mortal-wounds",
          "target": "enemy-within-aura",
          "modifier": {
            "count": "D6+2",
            "range": 6
          }
        },
        "on_fail": null
      }
    },
    "scope": {
      "range": "aura-6",
      "duration": "permanent"
    },
    "unit_ids": [
      "seraptek-heavy-construct"
    ],
    "ability_type": "core",
    "behavior": "reactive"
  },
  {
    "ability_id": "terrifying-monstrosity",
    "name": "Terrifying Monstrosity",
    "authored_by": "40kdc-community",
    "game_version": {
      "edition": "11th",
      "dataslate": "pre-launch-provisional"
    },
    "version": "2025-q3",
    "effect": {
      "type": "conditional",
      "condition": {
        "type": "phase-is",
        "parameters": {
          "phase": "fight"
        }
      },
      "effect": {
        "type": "leadership-modifier",
        "target": "enemy-within-aura",
        "modifier": {
          "test": "battle-shock"
        }
      }
    },
    "scope": {
      "range": "unit",
      "duration": "permanent"
    },
    "unit_ids": [
      "seraptek-heavy-construct"
    ],
    "ability_type": "unit",
    "behavior": "passive"
  },
  {
    "ability_id": "titanic-walker",
    "name": "Titanic Walker",
    "authored_by": "40kdc-community",
    "game_version": {
      "edition": "11th",
      "dataslate": "pre-launch-provisional"
    },
    "version": "2025-q3",
    "effect": {
      "type": "movement-modifier",
      "target": "self",
      "modifier": {
        "passthrough": [
          "all-terrain"
        ]
      }
    },
    "scope": {
      "range": "unit",
      "duration": "permanent"
    },
    "unit_ids": [
      "seraptek-heavy-construct"
    ],
    "ability_type": "unit",
    "behavior": "passive"
  },
  {
    "ability_id": "deep-strike",
    "name": "Deep Strike",
    "authored_by": "40kdc-community",
    "game_version": {
      "edition": "11th",
      "dataslate": "pre-launch-provisional"
    },
    "version": "2025-q3",
    "effect": {
      "type": "deep-strike",
      "target": "unit",
      "modifier": {}
    },
    "scope": {
      "range": "unit",
      "duration": "permanent"
    },
    "unit_ids": [
      "triarch-praetorians",
      "ctan-shard-of-the-nightbringer",
      "ctan-shard-of-the-void-dragon",
      "ctan-shard-of-the-deceiver",
      "transcendent-ctan",
      "nekrosor-ammentar"
    ],
    "ability_type": "core",
    "behavior": "activated"
  },
  {
    "ability_id": "relentless-combatants",
    "name": "Relentless Combatants",
    "authored_by": "40kdc-community",
    "game_version": {
      "edition": "11th",
      "dataslate": "pre-launch-provisional"
    },
    "version": "2025-q3",
    "effect": {
      "type": "re-roll",
      "target": "unit",
      "modifier": {
        "roll": "charge",
        "subset": "all-failures"
      }
    },
    "scope": {
      "range": "unit",
      "duration": "permanent"
    },
    "unit_ids": [
      "triarch-praetorians"
    ],
    "ability_type": "unit",
    "behavior": "passive"
  },
  {
    "ability_id": "their-number-is-legion",
    "name": "Their Number is Legion",
    "authored_by": "40kdc-community",
    "game_version": {
      "edition": "11th",
      "dataslate": "pre-launch-provisional"
    },
    "version": "2025-q3",
    "effect": {
      "type": "stat-modifier",
      "target": "unit",
      "modifier": {}
    },
    "scope": {
      "range": "unit",
      "duration": "permanent"
    },
    "unit_ids": [
      "necron-warriors"
    ],
    "ability_type": "unit",
    "behavior": "passive",
    "community_notes": "auto-generated stub — needs manual authoring (source: 10e Datasheets_abilities; rules text omitted for IP)"
  },
  {
    "ability_id": "scouts-8",
    "name": "Scouts 8\"",
    "authored_by": "40kdc-community",
    "game_version": {
      "edition": "11th",
      "dataslate": "pre-launch-provisional"
    },
    "version": "2025-q3",
    "effect": {
      "type": "movement-modifier",
      "target": "unit",
      "modifier": {
        "move_type": "scout",
        "distance": 8
      }
    },
    "scope": {
      "range": "unit",
      "duration": "permanent"
    },
    "unit_ids": [
      "canoptek-macrocytes"
    ],
    "ability_type": "core",
    "behavior": "activated"
  },
  {
    "ability_id": "harassment-swarm-aura",
    "name": "Harassment Swarm (Aura)",
    "authored_by": "40kdc-community",
    "game_version": {
      "edition": "11th",
      "dataslate": "pre-launch-provisional"
    },
    "version": "2025-q3",
    "effect": {
      "type": "roll-modifier",
      "target": "attacker",
      "modifier": {
        "roll": "hit",
        "operation": "subtract",
        "value": 1
      }
    },
    "scope": {
      "range": "aura-6",
      "duration": "permanent"
    },
    "unit_ids": [
      "canoptek-macrocytes"
    ],
    "ability_type": "unit",
    "behavior": "passive"
  },
  {
    "ability_id": "nanoscarab-projector",
    "name": "Nanoscarab Projector",
    "authored_by": "40kdc-community",
    "game_version": {
      "edition": "11th",
      "dataslate": "pre-launch-provisional"
    },
    "version": "2025-q3",
    "effect": {
      "type": "resurrection",
      "target": "unit",
      "modifier": {
        "type": "once-per-battle"
      }
    },
    "scope": {
      "range": "aura-6",
      "duration": "one-use"
    },
    "unit_ids": [
      "canoptek-macrocytes"
    ],
    "ability_type": "unit",
    "behavior": "activated"
  },
  {
    "ability_id": "accelerator-mandible",
    "name": "Accelerator Mandible",
    "authored_by": "40kdc-community",
    "game_version": {
      "edition": "11th",
      "dataslate": "pre-launch-provisional"
    },
    "version": "2025-q3",
    "effect": {
      "type": "stat-modifier",
      "target": "unit",
      "modifier": {}
    },
    "scope": {
      "range": "unit",
      "duration": "permanent"
    },
    "unit_ids": [
      "canoptek-macrocytes"
    ],
    "ability_type": "unit",
    "behavior": "passive",
    "community_notes": "auto-generated stub — needs manual authoring (source: 10e Datasheets_abilities; rules text omitted for IP)"
  },
  {
    "ability_id": "leader",
    "name": "Leader",
    "authored_by": "40kdc-community",
    "game_version": {
      "edition": "11th",
      "dataslate": "pre-launch-provisional"
    },
    "version": "2025-q3",
    "effect": {
      "type": "ability-grant",
      "target": "unit",
      "modifier": {
        "ability_id": "leader"
      }
    },
    "scope": {
      "range": "attached",
      "duration": "permanent"
    },
    "unit_ids": [
      "technomancer"
    ],
    "ability_type": "core",
    "behavior": "passive"
  },
  {
    "ability_id": "rites-of-reanimation",
    "name": "Rites of Reanimation",
    "authored_by": "40kdc-community",
    "game_version": {
      "edition": "11th",
      "dataslate": "pre-launch-provisional"
    },
    "version": "2025-q3",
    "effect": {
      "type": "conditional",
      "condition": {
        "type": "is-attached"
      },
      "effect": {
        "type": "feel-no-pain",
        "target": "unit",
        "modifier": {
          "threshold": 5
        }
      }
    },
    "scope": {
      "range": "unit",
      "duration": "permanent"
    },
    "unit_ids": [
      "technomancer"
    ],
    "ability_type": "unit",
    "behavior": "passive"
  },
  {
    "ability_id": "technomancer",
    "name": "Technomancer",
    "authored_by": "40kdc-community",
    "game_version": {
      "edition": "11th",
      "dataslate": "pre-launch-provisional"
    },
    "version": "2025-q3",
    "effect": {
      "type": "resurrection",
      "target": "self",
      "modifier": {
        "count": "d3",
        "type": "wounds"
      }
    },
    "scope": {
      "range": "aura-6",
      "duration": "permanent"
    },
    "unit_ids": [